{
  "id": "october-qad",
  "title": "ThreeWill Feud",
  "families": {
    "a": "Family A",
    "b": "Family B"
  },
  "win": {
    "targetPoints": 500,
    "hostCanEnd": true,
    "onTarget": "endAndMaybeLightning"
  },
  "lightning": {
    "enabled": false,
    "target": 200,
    "player1Seconds": 15,
    "player2Seconds": 20,
    "steal": true,
    "questions": [
      {
        "id": "TW-FUN-3",
        "source": "Pulse — 8 ThreeWillers",
        "question": "Name a phrase ThreeWillers say too often in a meeting.",
        "answers": [
          {
            "text": "Journey / partner with clients",
            "pts": 27
          },
          {
            "text": "Cadence",
            "pts": 18
          },
          {
            "text": "Dogfooding",
            "pts": 18
          },
          {
            "text": "\"I've got a hard stop\"",
            "pts": 9
          },
          {
            "text": "\"Oh, Tim\"",
            "pts": 9
          },
          {
            "text": "Passion",
            "pts": 9
          },
          {
            "text": "\"We lost XYZ managed services client\"",
            "pts": 9
          }
        ]
      },
      {
        "id": "TW-SER-2",
        "source": "Pulse — 8 ThreeWillers",
        "question": "Name a request ThreeWill clients make most often.",
        "answers": [
          {
            "text": "M365 help (Teams, group tasks, permissions)",
            "pts": 43
          },
          {
            "text": "Organize / migrate content",
            "pts": 14
          },
          {
            "text": "\"Email that to me\"",
            "pts": 14
          },
          {
            "text": "More features",
            "pts": 14
          },
          {
            "text": "Last-minute updates",
            "pts": 14
          }
        ]
      },
      {
        "id": "TW-SER-3",
        "source": "Pulse — 8 ThreeWillers",
        "question": "Name something a ThreeWiller does that shows we live our values.",
        "answers": [
          {
            "text": "Ownership / prepared / wear the customer hat",
            "pts": 30
          },
          {
            "text": "Community volunteering",
            "pts": 20
          },
          {
            "text": "Helping a teammate or client (Better Together)",
            "pts": 10
          },
          {
            "text": "Uber responsive",
            "pts": 10
          },
          {
            "text": "Protect client value / backlog",
            "pts": 10
          },
          {
            "text": "Humble confidence",
            "pts": 10
          },
          {
            "text": "Learn and share new tech",
            "pts": 10
          }
        ]
      },
      {
        "id": "IND-FUN-5",
        "source": "Owl Labs State of Hybrid Work 2024 (U.S.)",
        "question": "Name a hybrid / video-meeting pain point workers report.",
        "answers": [
          {
            "text": "Starting at 8 a.m. or earlier is too early",
            "pts": 21
          },
          {
            "text": "Lost time / meetings start late because of tech",
            "pts": 21
          },
          {
            "text": "Hard to see everyone's faces",
            "pts": 20
          },
          {
            "text": "Hard to hear everyone",
            "pts": 20
          },
          {
            "text": "Calendar-blocking to protect time from meetings",
            "pts": 16
          },
          {
            "text": "Meeting tech never works / unreliable",
            "pts": 2
          }
        ]
      },
      {
        "id": "IND-M365-2",
        "source": "Microsoft Work Trend Index (Copilot user goals)",
        "question": "Name a way people use AI / Copilot at work.",
        "answers": [
          {
            "text": "Decision-making",
            "pts": 28
          },
          {
            "text": "Other work activities",
            "pts": 19
          },
          {
            "text": "Information gathering",
            "pts": 13
          },
          {
            "text": "Documentation",
            "pts": 12
          },
          {
            "text": "Team communication",
            "pts": 8
          },
          {
            "text": "Computer tasks",
            "pts": 5
          },
          {
            "text": "Information interpretation",
            "pts": 5
          },
          {
            "text": "Information processing",
            "pts": 3
          }
        ]
      }
    ]
  },
  "boards": [
    {
      "id": "TW-FUN-1",
      "pool": "live",
      "source": "Pulse — 8 ThreeWillers",
      "question": "Name something that happens on a ThreeWill Teams meeting that makes people laugh or groan.",
      "answers": [
        {
          "text": "Tim's jokes / potty / bathroom humor",
          "pts": 36
        },
        {
          "text": "\"There's Mike\" / walks in at the start",
          "pts": 21
        },
        {
          "text": "Visual bits (Jim's camel, AI pics, funny outfit)",
          "pts": 21
        },
        {
          "text": "Talking on mute",
          "pts": 14
        },
        {
          "text": "Last-second extra question",
          "pts": 7
        }
      ]
    },
    {
      "id": "IND-FUN-1",
      "pool": "live",
      "source": "Currys / 1,000 UK desk workers",
      "question": "Name an annoying habit on a video call.",
      "answers": [
        {
          "text": "Eating",
          "pts": 21
        },
        {
          "text": "Burping / farting",
          "pts": 16
        },
        {
          "text": "Inappropriate comments",
          "pts": 16
        },
        {
          "text": "Interrupting",
          "pts": 15
        },
        {
          "text": "Mumbling",
          "pts": 14
        },
        {
          "text": "Background noise",
          "pts": 13
        },
        {
          "text": "Camera off",
          "pts": 5
        }
      ]
    },
    {
      "id": "TW-SER-1",
      "pool": "live",
      "source": "Pulse — 8 ThreeWillers",
      "question": "Name a top reason a ThreeWill engagement goes off track.",
      "answers": [
        {
          "text": "Client unengaged / no-show / unresponsive",
          "pts": 30
        },
        {
          "text": "Scope / \"the client\" changing",
          "pts": 20
        },
        {
          "text": "Miscommunication",
          "pts": 20
        },
        {
          "text": "Expectation / MS value-prop mismatch",
          "pts": 20
        },
        {
          "text": "Too many clients at once",
          "pts": 10
        }
      ]
    },
    {
      "id": "IND-M365-1",
      "pool": "live",
      "source": "ShareGate State of Microsoft 365 2026 (IT, n=943)",
      "question": "Name a top concern IT has about using Microsoft Copilot.",
      "answers": [
        {
          "text": "Data quality, relevance, and retention",
          "pts": 21
        },
        {
          "text": "Security and access management",
          "pts": 21
        },
        {
          "text": "Lack of internal AI-governance expertise",
          "pts": 15
        },
        {
          "text": "Realizing ROI of Copilot",
          "pts": 14
        },
        {
          "text": "Cost control",
          "pts": 11
        },
        {
          "text": "Ongoing governance / access after deployment",
          "pts": 10
        },
        {
          "text": "Governing AI agents, plugins, and automations",
          "pts": 8
        }
      ]
    },
    {
      "id": "TW-SER-5",
      "pool": "live",
      "source": "Pulse — 8 ThreeWillers",
      "question": "Name something ThreeWill clients thank the team for.",
      "answers": [
        {
          "text": "Care / listen / want them successful",
          "pts": 29
        },
        {
          "text": "Responsiveness",
          "pts": 21
        },
        {
          "text": "Quality / on time / good work",
          "pts": 21
        },
        {
          "text": "Keep commitments",
          "pts": 7
        },
        {
          "text": "Training",
          "pts": 7
        },
        {
          "text": "Clear communication",
          "pts": 7
        },
        {
          "text": "Expertise",
          "pts": 7
        },
        {
          "text": "\"Velvet hammer\" / moving them along",
          "pts": 7
        }
      ]
    },
    {
      "id": "TW-SER-6",
      "pool": "live",
      "source": "Pulse — 8 ThreeWillers",
      "question": "Name what \"good\" looks like on a Managed Services (or similar) engagement.",
      "answers": [
        {
          "text": "2x value / hours saved",
          "pts": 25
        },
        {
          "text": "Trust / happy / recurring client",
          "pts": 17
        },
        {
          "text": "People actually use the work",
          "pts": 17
        },
        {
          "text": "More work than time / visible board",
          "pts": 17
        },
        {
          "text": "Issues resolved quickly",
          "pts": 8
        },
        {
          "text": "Go-to M365 person",
          "pts": 8
        },
        {
          "text": "High QIM / EOS scores",
          "pts": 8
        }
      ]
    },
    {
      "id": "IND-HS-1",
      "pool": "live",
      "source": "CNP / PNP Staffing 2024 nonprofit employers",
      "question": "Name a workforce challenge nonprofit / human-services employers report.",
      "answers": [
        {
          "text": "Offering competitive salaries",
          "pts": 21
        },
        {
          "text": "Change management",
          "pts": 14
        },
        {
          "text": "Professional development / upskilling",
          "pts": 13
        },
        {
          "text": "Turnover / retention",
          "pts": 11
        },
        {
          "text": "Employee engagement",
          "pts": 11
        },
        {